<?xml version="1.0"?>

<!-- 
good-natured task set with full utilisation through periodic tasks

PeriodicTask t7p1(1, 6, 2, 6, new UCAL, new UAGR, 0);
PeriodicTask t7p2(2, 8, 2, 8, new UCAL, new UAGR, 2);
PeriodicTask t7p3(3, 12, 3, 12, new UCAL, new UAGR, 4);
PeriodicTask t7p4(4, 6, 1, 6, new UCAL, new UAGR, 5);

SporadicTask t7s1(11, 13, 1, 0xcafe600d, 5, new UCAL, new UAGR, 0.33);
SporadicTask t7s2(11, 19, 1, 0xbadcafe0, 5, new UCAL, new UAGR, 0.33);
-->

<taskset
  xmlns="http://www.tmsxmlns.com"
  xmlns:xsi="http://www.w3.org/2001/XMLSchema-instance"
  xsi:schemaLocation="http://www.tmsxmlns.com taskset.xsd">

  <periodictask>
    <id>1</id>
    <executiontime>2</executiontime>
    <criticaltime>6</criticaltime>
    <ucfirmrt></ucfirmrt>
    <uaexp>
    	<weight>0.5</weight>
    </uaexp>
    <priority>0</priority>
    <period>6</period>
    <offset>0</offset>
  </periodictask>
 
  <periodictask>
    <id>2</id>
    <executiontime>2</executiontime>
    <criticaltime>8</criticaltime>
    <ucfirmrt></ucfirmrt>
    <uaexp>
    	<weight>0.5</weight>
    </uaexp>
    <priority>2</priority>
    <period>8</period>
    <offset>0</offset>
  </periodictask>
  
  <periodictask>
    <id>3</id>
    <executiontime>3</executiontime>
    <criticaltime>12</criticaltime>
    <ucfirmrt></ucfirmrt>
    <uaexp>
    	<weight>0.5</weight>
    </uaexp>
    <priority>4</priority>
    <period>12</period>
    <offset>0</offset>
  </periodictask>
  
  <periodictask>
    <id>4</id>
    <executiontime>1</executiontime>
    <criticaltime>6</criticaltime>
    <ucfirmrt></ucfirmrt>
    <uaexp>
    	<weight>0.5</weight>
    </uaexp>
    <priority>5</priority>
    <period>6</period>
    <offset>0</offset>
  </periodictask>
  
  <sporadictask>
    <id>11</id>
    <executiontime>1</executiontime>
    <criticaltime>5</criticaltime>
    <ucfirmrt></ucfirmrt>
    <uaexp>
		<weight>0.5</weight>
    </uaexp>
    <priority>1</priority>
    <minperiod>13</minperiod>
    <seed>0xcafe600d</seed>
    <probability>0.33</probability>
    <offset>0</offset>   
  </sporadictask>
  
  <sporadictask>
    <id>12</id>
    <executiontime>1</executiontime>
    <criticaltime>5</criticaltime>
    <ucfirmrt></ucfirmrt>
    <uaexp>
		<weight>0.5</weight>
    </uaexp>
    <priority>1</priority>
    <minperiod>19</minperiod>
    <seed>0xbadcafe0</seed>
    <probability>0.33</probability>
    <offset>0</offset>   
  </sporadictask>
  
</taskset>