<?xml version="1.0" encoding="UTF-8"?>
<!--Hier kommen die Tasks-->
<taskset xmlns="http://www.tmsxmlns.com" xmlns:xsi="http://www.w3.org/2001/XMLSchema-instance" xsi:schemaLocation="http://www.tmsxmlns.com taskset.xsd">

  <periodictask>
    <id>1</id>
    <executiontime>2</executiontime>
    <criticaltime>12</criticaltime>
    <ucfirmrt/>
    <uaexp>
      <weight>0.5</weight>
    </uaexp>
    <priority>0</priority>
    <period>12</period>
    <offset>0</offset>
  </periodictask>


  <periodictask>
    <id>2</id>
    <executiontime>2</executiontime>
    <criticaltime>12</criticaltime>
    <ucfirmrt/>
    <uaexp>
      <weight>0.5</weight>
    </uaexp>
    <priority>2</priority>
    <period>12</period>
    <offset>0</offset>
  </periodictask>


  <periodictask>
    <id>3</id>
    <executiontime>2</executiontime>
    <criticaltime>12</criticaltime>
    <ucfirmrt/>
    <uaexp>
      <weight>0.5</weight>
    </uaexp>
    <priority>4</priority>
    <period>12</period>
    <offset>0</offset>
  </periodictask>


  <sporadictask>
    <id>11</id>
    <executiontime>1</executiontime>
    <criticaltime>5</criticaltime>
    <ucfirmrt/>
    <uaexp>
      <weight>0.5</weight>
    </uaexp>
    <priority>1</priority>
    <minperiod>-1</minperiod>
    <seed>0xcafe600d</seed>
    <probability>0.33</probability>
    <offset>0</offset>
  </sporadictask>


  <sporadictask>
    <id>12</id>
    <executiontime>1</executiontime>
    <criticaltime>5</criticaltime>
    <ucfirmrt/>
    <uaexp>
      <weight>0.5</weight>
    </uaexp>
    <priority>1</priority>
    <minperiod>-1</minperiod>
    <seed>0xcafebad</seed>
    <probability>0.33</probability>
    <offset>0</offset>
  </sporadictask>


  <sporadictask>
    <id>13</id>
    <executiontime>1</executiontime>
    <criticaltime>5</criticaltime>
    <ucfirmrt/>
    <uaexp>
      <weight>0.5</weight>
    </uaexp>
    <priority>1</priority>
    <minperiod>-1</minperiod>
    <seed>0xcafebad0</seed>
    <probability>0.33</probability>
    <offset>0</offset>
  </sporadictask>

</taskset>
