<?xml version="1.0"?>

<taskset
  xmlns="http://www.tmsxmlns.com"
  xmlns:xsi="http://www.w3.org/2001/XMLSchema-instance"
  xsi:schemaLocation="http://www.tmsxmlns.com taskset.xsd">

  <periodictask>
    <id>1</id>
    <executiontime>12</executiontime>
    <criticaltime>2</criticaltime>
    <ucfirmrt></ucfirmrt>
    <uaexp>
    	<weight>0.5</weight>
    </uaexp>
    <priority>1</priority>
    <period>12</period>
    <offset>0</offset>
  </periodictask>
  
  <periodictask>
    <id>2</id>
    <executiontime>12</executiontime>
    <criticaltime>2</criticaltime>
    <ucfirmrt></ucfirmrt>
   	<uaexp>
		<weight>0.5</weight>
    </uaexp>
    <priority>1</priority>
    <period>12</period>
    <offset>2</offset>
  </periodictask>
  
  <periodictask>
    <id>3</id>
    <executiontime>12</executiontime>
    <criticaltime>2</criticaltime>
    <ucfirmrt></ucfirmrt>
    <uaexp>
		<weight>0.5</weight>
    </uaexp>
    <priority>1</priority>
    <period>12</period>
    <offset>4</offset>
  </periodictask>

  <sporadictask>
    <id>11</id>
    <executiontime>1</executiontime>
    <criticaltime>5</criticaltime>
    <ucfirmrt></ucfirmrt>
    <uaexp>
		<weight>0.5</weight>
    </uaexp>
    <priority>1</priority>
    <minperiod>5</minperiod>
    <seed>0xcafe600d</seed>
    <probability>0.33</probability>
    <offset>0</offset>
    
  </sporadictask>

  <sporadictask>
    <id>12</id>
    <executiontime>1</executiontime>
    <criticaltime>5</criticaltime>
    <ucfirmrt></ucfirmrt>
    <uaexp>
		<weight>0.5</weight>
    </uaexp>
    <priority>1</priority>
    <minperiod>5</minperiod>
    <seed>0x0cafebad</seed>
    <probability>0.33</probability>
    <offset>0</offset>
    
  </sporadictask>

  <sporadictask>
    <id>13</id>
    <executiontime>1</executiontime>
    <criticaltime>5</criticaltime>
    <ucfirmrt></ucfirmrt>
    <uaexp>
		<weight>0.5</weight>
    </uaexp>
    <priority>1</priority>
    <minperiod>5</minperiod>
    <seed>0xcafebad0</seed>
    <probability>0.33</probability>
    <offset>0</offset>
    
  </sporadictask>
  
  <mkftask>
    <id>14</id>
    <executiontime>1</executiontime>
    <criticaltime>5</criticaltime>
    <ucfirmrt></ucfirmrt>
    <uaexp>
		<weight>0.5</weight>
    </uaexp>
    <priority>1</priority>
    <period>5</period>
    <m>9</m>
    <k>6</k>
  </mkftask>
  
  <sporadicperiodictask>
    <id>15</id>
    <executiontime>12</executiontime>
    <criticaltime>2</criticaltime>
    <ucfirmrt></ucfirmrt>
    <uaexp>
		<weight>0.5</weight>
    </uaexp>
    <priority>1</priority>
    <period>12</period>
    <offset>4</offset>
    <seed>0xcafebad0</seed>
    <probability>0.33</probability>
  </sporadicperiodictask>

</taskset>